<?xml version="1.0" encoding="UTF-8" ?>
<xs:schema xmlns:xs="http://www.w3.org/2001/XMLSchema">
    <xs:element name="hr">
        <!-- have to use this to include child labels -->
        <xs:complexType>
            <xs:sequence>
                <xs:element name="employee" minOccurs="1" maxOccurs="9999">
                    <xs:complexType>
                        <xs:sequence>
                            <xs:element name="name" type="xs:string"></xs:element>
                            <xs:element name="age">
                                <xs:simpleType>
                                    <xs:restriction base="xs:integer">
                                        <xs:minInclusive value="18"></xs:minInclusive>
                                        <xs:maxInclusive value="65"></xs:maxInclusive>
                                    </xs:restriction>
                                </xs:simpleType>
                            </xs:element>
                            <xs:element name="salary" type="xs:integer"></xs:element>
                            <xs:element name="department">
                                <xs:complexType>
                                    <xs:sequence>
                                        <xs:element name="dname" type="xs:string"></xs:element>
                                        <xs:element name="address" type="xs:string"></xs:element>
                                    </xs:sequence>
                                </xs:complexType>
                            </xs:element>
                        </xs:sequence>
                        <xs:attribute name="no" type="xs:string" use="required"></xs:attribute>
                    </xs:complexType>
                </xs:element>
            </xs:sequence>
        </xs:complexType>
    </xs:element>
</xs:schema>