<?xml version="1.0" encoding="UTF-8"?>
<!-- Human Resource Manegement System-->
<hr xmlns:xsi="http://www.w3.org/2001/XMLSchema-instance" xsi:noNamespaceSchemaLocation="hr.xsd">
	<employee no="3309">
		<name>ZhangSan</name>
		<age>23</age>
		<salary>4000</salary>
		<department>
			<dname>Accounting</dname>
			<address>xxxstreat-B103</address>
		</department>
	</employee>
	<employee no="3310">
		<name>Lisi</name>
		<age>23</age>
		<salary>3000</salary>
		<department>
			<dname>Engineering</dname>
			<address>xxxstreat-B104</address>
		</department>
	</employee>
</hr>
